question,consistent body,inconsistent body,consistent paraphrased,inconsistent paraphrased,answer
How many backpacks does Joseph have in their collection now?,Lucy has 4 backpacks. Lucy possesses 9 kilowatt-hours of emergency energy reserve per backpack. Lucy bought 11 kilowatt-hours more emergency energy reserve. Joseph has 1/2 the amount of backpacks as Lucy. Joseph bought 18 backpacks.,Lucy has 4 backpacks. Lucy possesses 9 kilowatt-hours of emergency energy reserve per backpack. Lucy bought 11 kilowatt-hours more emergency energy reserve. Lucy has 2 times as many backpacks as Joseph. Joseph bought 18 backpacks.,Lucy has 4 backpacks. Each backpack possesses 9 kilowatt-hours of emergency energy reserve. Lucy bought 11 kilowatt-hours more of emergency energy reserve. Joseph has half the number of backpacks as Lucy. Joseph bought 18 backpacks. How many backpacks does Joseph have in their collection now?,Lucy has 4 backpacks. Each backpack possesses 9 kilowatt-hours of emergency energy reserve. Lucy bought 11 kilowatt-hours more of emergency energy reserve. Lucy has twice as many backpacks as Joseph. Joseph bought 18 backpacks. How many backpacks does Joseph have in their collection now?,20
How many kilowatt-hours of emergency energy reserve does John have?,Layla has 20 kilowatt-hours of emergency energy reserve. Layla bought 7 kilowatt-hours more emergency energy reserve. Layla bought 17 kilowatt-hours more emergency energy reserve. John has 7 kilowatt-hours of emergency energy reserve more than Layla.,Layla has 20 kilowatt-hours of emergency energy reserve. Layla bought 7 kilowatt-hours more emergency energy reserve. Layla bought 17 kilowatt-hours more emergency energy reserve. Layla has 7 kilowatt-hours of emergency energy reserve less than John.,Layla has 20 kilowatt-hours of emergency energy reserve. Layla bought 7 more kilowatt-hours of emergency energy reserve. Layla bought 17 more kilowatt-hours of emergency energy reserve. John has 7 kilowatt-hours more of emergency energy reserve than Layla. How many kilowatt-hours of emergency energy reserve does John have?,Layla has 20 kilowatt-hours of emergency energy reserve. Layla bought 7 more kilowatt-hours of emergency energy reserve. Layla bought 17 more kilowatt-hours of emergency energy reserve. Layla has 7 kilowatt-hours less of emergency energy reserves than John. How many kilowatt-hours of emergency energy reserve does John have?,51
What is the number of red knifes that Christopher has now?,Jackson has 9 red knifes.  Christopher has 1/9 the amount of red knifes compared to the amount Jackson has. Christopher bought 6 red knifes.,Jackson has 9 red knifes.  Jackson has 9 times the amount of red knifes compared to the amount Christopher has. Christopher bought 6 red knifes.,Jackson has 9 red knives. Christopher has 1/9 the number of red knives that Jackson has. Christopher bought 6 red knives. What is the number of red knives that Christopher has now?,Jackson has 9 red knives. Jackson has 9 times the number of red knives compared to the number Christopher has. Christopher bought 6 red knives. What is the number of red knives that Christopher has now?,7
How many blenders does Chloe have in all?,There are 7 backpacks in Abigail's collection. Each of Abigail's backpack holds 3 boxs. Abigail bought 5 more boxs. Chloe has 1/13 the amount of boxs as Abigail. Chloe bought 14 boxs. There are 19 blenders in every Chloe's box.,There are 7 backpacks in Abigail's collection. Each of Abigail's backpack holds 3 boxs. Abigail bought 5 more boxs. Abigail has 13 times as many boxs as Chloe. Chloe bought 14 boxs. There are 19 blenders in every Chloe's box.,There are 7 backpacks in Abigail's collection. Each of Abigail's backpack holds 3 boxes. Abigail bought 5 more boxes. Chloe has 1/13 the amount of boxes as Abigail. Chloe bought 14 boxes. There are 19 blenders in every box Chloe has. How many blenders does Chloe have in all?,There are 7 backpacks in Abigail's collection. Each of Abigail's backpack holds 3 boxes. Abigail bought 5 more boxes. Abigail has 13 times as many boxes as Chloe. Chloe bought 14 boxes. There are 19 blenders in every box Chloe has. How many blenders does Chloe have in all?,304
How many washing machines does Abigail have totaled now?,There are 20 bags in John's collection. Each of John's bag holds 4 bookshelfs. Abigail has 1/20 the amount of bags as John. Every bag that Abigail has contains 11 washing machines. Abigail bought 12 more washing machines.,There are 20 bags in John's collection. Each of John's bag holds 4 bookshelfs. John has 20 times as many bags as Abigail. Every bag that Abigail has contains 11 washing machines. Abigail bought 12 more washing machines.,There are 20 bags in John's collection. Each of John's bags holds 4 bookshelves. Abigail has 1/20th the amount of bags as John. Every bag that Abigail has contains 11 washing machines. Abigail bought 12 more washing machines. How many washing machines does Abigail have in total now?,There are 20 bags in John's collection. Each of John's bags holds 4 bookshelves. John has 20 times as many bags as Abigail. Every bag that Abigail has contains 11 washing machines. Abigail bought 12 more washing machines. How many washing machines does Abigail have in total now?,23
How many bags does Lucy have in all now?,Avery has 9 bags. Avery bought 13 more bags. Each of Avery's bag has 3 beds. Lucy has 1/11 the amount of bags as Avery. Lucy bought 8 more bags.,Avery has 9 bags. Avery bought 13 more bags. Each of Avery's bag has 3 beds. Avery has 11 times as many bags as Lucy. Lucy bought 8 more bags.,Avery has 9 bags. Avery bought 13 more bags. Each of Avery's bags has 3 beds. Lucy has 1/11 the number of bags as Avery. Lucy bought 8 more bags. How many bags does Lucy have in total now?,Avery has 9 bags. Avery bought 13 more bags. Each of Avery's bags has 3 beds. Avery has 11 times as many bags as Lucy. Lucy bought 8 more bags. How many bags does Lucy have in total now?,10
How many televisions does Elizabeth have in total now?,Michael owns 2 packages. Each of Michael's package holds 20 televisions. Elizabeth has 15 more televisions than Michael. Elizabeth bought 10 televisions.,Michael owns 2 packages. Each of Michael's package holds 20 televisions. Michael has 15 fewer televisions than Elizabeth. Elizabeth bought 10 televisions.,Michael owns 2 packages. Each package holds 20 televisions. Elizabeth has 15 more televisions than Michael. Elizabeth bought 10 televisions. How many televisions does Elizabeth have in total now?,Michael owns 2 packages. Each package holds 20 televisions. Michael has 15 fewer televisions than Elizabeth. Elizabeth bought 10 televisions. How many televisions does Elizabeth have in total now?,65
How many gigabytes of training data does Abigail have?,Michael owns 20 packages. Each of Michael's package has 3 boxs. Abigail has 1/4 the amount of boxs as Michael. Abigail possesses 19 gigabytes of training data per box.,Michael owns 20 packages. Each of Michael's package has 3 boxs. Michael has 4 times as many boxs as Abigail. Abigail possesses 19 gigabytes of training data per box.,Michael owns 20 packages. Each of Michael's packages has 3 boxes. Abigail has 1/4 the number of boxes as Michael. Abigail possesses 19 gigabytes of training data per box. How many gigabytes of training data does Abigail have?,Michael owns 20 packages. Each of Michael's packages has 3 boxes. Michael has 4 times as many boxes as Abigail. Abigail possesses 19 gigabytes of training data per box. How many gigabytes of training data does Abigail have?,285
How many plates does Jackson have in total?,There are 9 bags in Amelia's collection. Jackson has 6 fewer bags than Amelia. Each of Jackson's bag has 15 plates.,There are 9 bags in Amelia's collection. Amelia has 6 more bags than Jackson. Each of Jackson's bag has 15 plates.,There are 9 bags in Amelia's collection. Jackson has 6 fewer bags than Amelia. Each of Jackson's bags has 15 plates. How many plates does Jackson have in total?,There are 9 bags in Amelia's collection. Amelia has 6 more bags than Jackson. Each of Jackson's bags has 15 plates. How many plates does Jackson have in total?,45
What is the number of red forks that James has?,William has 5 blue packages. William possesses 20 green bag for every blue package. William bought 14 green bags. James has 19 fewer green bags than William. James possesses 3 red fork for every green bag.,William has 5 blue packages. William possesses 20 green bag for every blue package. William bought 14 green bags. William has 19 more green bags than James. James possesses 3 red fork for every green bag.,William has 5 blue packages. William possesses 20 green bags for every blue package. William bought 14 green bags. James has 19 fewer green bags than William. James possesses 3 red forks for every green bag. What is the number of red forks that James has?,William has 5 blue packages. William possesses 20 green bags for every blue package. William bought 14 green bags. William has 19 more green bags than James. James possesses 3 red forks for every green bag. What is the number of red forks that James has?,285
How many bowls does Avery have in their collection?,John owns 10 bowls. John bought 3 more bowls. John bought 14 bowls. Avery has 1/9 the amount of bowls as John.,John owns 10 bowls. John bought 3 more bowls. John bought 14 bowls. John has 9 times as many bowls as Avery.,John owns 10 bowls. John bought 3 additional bowls. John bought 14 bowls. Avery has 1/9 of the number of bowls as John. How many bowls does Avery have in their collection?,John owns 10 bowls. John bought 3 additional bowls. John bought 14 bowls. John has 9 times as many bowls as Avery. How many bowls does Avery have in their collection?,3
How many keys does David have?,Matthew has 13 boxs. Matthew bought 5 more boxs. David has 13 more boxs than Matthew. David bought 16 more boxs. Every box that David has contains 9 keys.,Matthew has 13 boxs. Matthew bought 5 more boxs. Matthew has 13 fewer boxs than David. David bought 16 more boxs. Every box that David has contains 9 keys.,Matthew has 13 boxes. Matthew bought 5 more boxes. David has 13 more boxes than Matthew. David bought 16 more boxes. Every box that David has contains 9 keys. How many keys does David have?,Matthew has 13 boxes. Matthew bought 5 more boxes. Matthew has 13 fewer boxes than David. David bought 16 more boxes. Every box that David has contains 9 keys. How many keys does David have?,423
How many toasters does Abigail have totaled?,Elizabeth has 3 backpacks. Abigail has 8 times as many backpacks as Elizabeth. Each of Abigail's backpack has 4 toasters.,Elizabeth has 3 backpacks. Elizabeth has 1/8 the amount of backpacks as Abigail. Each of Abigail's backpack has 4 toasters.,Elizabeth has 3 backpacks. Abigail has 8 times as many backpacks as Elizabeth. Each of Abigail's backpacks has 4 toasters. How many toasters does Abigail have in total?,Elizabeth has 3 backpacks. Elizabeth has 1/8 the number of backpacks as Abigail. Each of Abigail's backpacks has 4 toasters. How many toasters does Abigail have in total?,96
How many kilograms of gold does Joseph have now?,Grace has 9 kilograms of gold. Joseph has 18 kilograms of gold more than Grace. Joseph bought 18 kilograms more gold.,Grace has 9 kilograms of gold. Grace has 18 kilograms of gold less than Joseph. Joseph bought 18 kilograms more gold.,Grace has 9 kilograms of gold. Joseph has 18 kilograms more gold than Grace. Joseph bought 18 kilograms more gold. How many kilograms of gold does Joseph have now?,Grace has 9 kilograms of gold. Grace has 18 kilograms less gold than Joseph. Joseph bought 18 kilograms more gold. How many kilograms of gold does Joseph have now?,45
What is the number of red watchs that Ryan has?,Jackson has 4 orange suitcases. Jackson bought 9 orange suitcases. Jackson possesses 3 green package for every orange suitcase. Ryan has 20 fewer green packages than Jackson. Ryan bought 4 green packages. Ryan possesses 2 red watch for every green package.,Jackson has 4 orange suitcases. Jackson bought 9 orange suitcases. Jackson possesses 3 green package for every orange suitcase. Jackson has 20 more green packages than Ryan. Ryan bought 4 green packages. Ryan possesses 2 red watch for every green package.,Jackson has 4 orange suitcases. Jackson bought 9 more orange suitcases. Jackson possesses 3 green packages for every orange suitcase. Ryan has 20 fewer green packages than Jackson. Ryan bought 4 green packages. Ryan possesses 2 red watches for every green package. What is the number of red watches that Ryan has?,Jackson has 4 orange suitcases. Jackson bought 9 more orange suitcases. Jackson possesses 3 green packages for every orange suitcase. Jackson has 20 more green packages than Ryan. Ryan bought 4 green packages. Ryan possesses 2 red watches for every green package. What is the number of red watches that Ryan has?,46
What is the number of red baskets that Lucy has now?,Matthew has 19 red baskets. Matthew possesses 13 small microwave for every red basket. Matthew bought 7 small microwaves.  Lucy has 8 times the amount of red baskets compared to the amount Matthew has. Lucy bought 12 red baskets.,Matthew has 19 red baskets. Matthew possesses 13 small microwave for every red basket. Matthew bought 7 small microwaves.  Matthew has 1/8 the amount of red baskets compared to the amount Lucy has. Lucy bought 12 red baskets.,Matthew has 19 red baskets. Matthew possesses 13 small microwaves for every red basket. Matthew bought 7 small microwaves. Lucy has 8 times the number of red baskets compared to Matthew. Lucy bought 12 red baskets. What is the number of red baskets that Lucy has now?,Matthew has 19 red baskets. Matthew possesses 13 small microwaves for every red basket. Matthew bought 7 small microwaves. Matthew has 1/8 the number of red baskets compared to the number Lucy has. Lucy bought 12 red baskets. What is the number of red baskets that Lucy has now?,164
How many meters of rope does Sophia have?,Sofia owns 10 suitcases. Sofia bought 3 more suitcases. Sofia possesses 16 meters of rope per suitcase. Sophia has 15 meters of rope more than Sofia.,Sofia owns 10 suitcases. Sofia bought 3 more suitcases. Sofia possesses 16 meters of rope per suitcase. Sofia has 15 meters of rope less than Sophia.,Sofia owns 10 suitcases. Sofia bought 3 more suitcases. Sofia possesses 16 meters of rope per suitcase. Sophia has 15 meters of rope more than Sofia. How many meters of rope does Sophia have?,Sofia owns 10 suitcases. Sofia bought 3 more suitcases. Sofia possesses 16 meters of rope per suitcase. Sofia has 15 meters of rope less than Sophia. How many meters of rope does Sophia have?,223
How many umbrellas does David have in total?,There are 2 umbrellas in Jacob's collection. Jacob bought 17 umbrellas. David has 12 more umbrellas than Jacob.,There are 2 umbrellas in Jacob's collection. Jacob bought 17 umbrellas. Jacob has 12 fewer umbrellas than David.,There are 2 umbrellas in Jacob's collection. Jacob bought 17 umbrellas. David has 12 more umbrellas than Jacob. How many umbrellas does David have in total?,There are 2 umbrellas in Jacob's collection. Jacob bought 17 umbrellas. Jacob has 12 fewer umbrellas than David. How many umbrellas does David have in total?,31
How many mirrors does Ella have totaled?,There are 13 mirrors in Avery's collection. Ella has 4 fewer mirrors than Avery.,There are 13 mirrors in Avery's collection. Avery has 4 more mirrors than Ella.,There are 13 mirrors in Avery's collection. Ella has 4 fewer mirrors than Avery. How many mirrors does Ella have in total?,There are 13 mirrors in Avery's collection. Avery has 4 more mirrors than Ella. How many mirrors does Ella have in total?,9
How many packages does Elizabeth have in total now?,James owns 9 backpacks. Each of James's backpack holds 10 packages. There are 5 juicers in every James's package. Elizabeth has 20 fewer packages than James. Elizabeth bought 5 more packages. Elizabeth bought 10 more packages.,James owns 9 backpacks. Each of James's backpack holds 10 packages. There are 5 juicers in every James's package. James has 20 more packages than Elizabeth. Elizabeth bought 5 more packages. Elizabeth bought 10 more packages.,James owns 9 backpacks. Each of James's backpacks holds 10 packages. There are 5 juicers in every package of James's. Elizabeth has 20 fewer packages than James. Elizabeth bought 5 more packages. Elizabeth bought 10 more packages. How many packages does Elizabeth have in total now?,James owns 9 backpacks. Each of James's backpacks holds 10 packages. There are 5 juicers in every package of James's. James has 20 more packages than Elizabeth. Elizabeth bought 5 more packages. Elizabeth bought 10 more packages. How many packages does Elizabeth have in total now?,85
How many watchs does Ava have in all?,There are 10 watchs in James's collection. James bought 9 more watchs. Ava has 5 times as many watchs as James.,There are 10 watchs in James's collection. James bought 9 more watchs. James has 1/5 the amount of watchs as Ava.,There are 10 watches in James's collection. James bought 9 more watches. Ava has 5 times as many watches as James. How many watches does Ava have in total?,There are 10 watches in James's collection. James bought 9 more watches. James has 1/5 the number of watches as Ava. How many watches does Ava have in total?,95
How many meters of rope does Joseph have now?,Ryan has 17 meters of rope. Joseph has 1/17 as much rope in meters as Ryan does. Joseph bought 11 meters more rope.,Ryan has 17 meters of rope. Ryan has 17 times as much rope in meters as Joseph does. Joseph bought 11 meters more rope.,Ryan has 17 meters of rope. Joseph has 1/17 as much rope in meters as Ryan does. Joseph bought 11 more meters of rope. How many meters of rope does Joseph have now?,Ryan has 17 meters of rope. Ryan has 17 times as much rope in meters as Joseph does. Joseph bought 11 more meters of rope. How many meters of rope does Joseph have now?,12
How many keys does Mila have in total?,There are 2 packages in Sophia's collection. Each of Sophia's package holds 8 keys. Sophia bought 13 more keys. Mila has 7 times as many keys as Sophia.,There are 2 packages in Sophia's collection. Each of Sophia's package holds 8 keys. Sophia bought 13 more keys. Sophia has 1/7 the amount of keys as Mila.,There are 2 packages in Sophia's collection. Each package holds 8 keys. Sophia bought 13 more keys. Mila has 7 times as many keys as Sophia. How many keys does Mila have in total?,There are 2 packages in Sophia's collection. Each package holds 8 keys. Sophia bought 13 more keys. Sophia has 1/7 of the amount of keys as Mila. How many keys does Mila have in total?,203
How many grams of butter does Ryan have?,Charlotte has 11 grams of butter. Ryan has 15 grams of butter more than Charlotte.,Charlotte has 11 grams of butter. Charlotte has 15 grams of butter less than Ryan.,Charlotte has 11 grams of butter. Ryan has 15 grams more butter than Charlotte. How many grams of butter does Ryan have?,Charlotte has 11 grams of butter. Charlotte has 15 grams less butter than Ryan. How many grams of butter does Ryan have?,26
How many soaps does Natalie have in total now?,Ryan has 10 soaps. Natalie has 18 times as many soaps as Ryan. Natalie bought 11 soaps.,Ryan has 10 soaps. Ryan has 1/18 the amount of soaps as Natalie. Natalie bought 11 soaps.,Ryan has 10 soaps. Natalie has 18 times as many soaps as Ryan. Natalie bought 11 soaps. How many soaps does Natalie have in total now?,Ryan has 10 soaps. Ryan has 1/18th the amount of soaps as Natalie. Natalie bought 11 soaps. How many soaps does Natalie have in total now?,191
What is the number of small plants that Emily has now?,Amelia has 10 small plants.  Emily has 1/5 the amount of small plants compared to the amount Amelia has. Emily bought 6 small plants.,Amelia has 10 small plants.  Amelia has 5 times the amount of small plants compared to the amount Emily has. Emily bought 6 small plants.,Amelia has 10 small plants. Emily has 1/5 of the number of small plants that Amelia has. Emily bought 6 small plants. What is the number of small plants that Emily has now?,Amelia has 10 small plants. Amelia has 5 times the number of small plants that Emily has. Emily bought 6 small plants. What is the number of small plants that Emily has now?,8
How many rolls of toilet papers does Benjamin have in total?,Mia has 6 packages. Every package that Mia has contains 8 suitcases. Benjamin has 3 fewer suitcases than Mia. Benjamin bought 3 more suitcases. There are 4 rolls of toilet papers in every Benjamin's suitcase.,Mia has 6 packages. Every package that Mia has contains 8 suitcases. Mia has 3 more suitcases than Benjamin. Benjamin bought 3 more suitcases. There are 4 rolls of toilet papers in every Benjamin's suitcase.,Mia has 6 packages. Each package that Mia has contains 8 suitcases. Benjamin has 3 fewer suitcases than Mia. Benjamin bought 3 more suitcases. There are 4 rolls of toilet paper in each of Benjamin's suitcases. How many rolls of toilet paper does Benjamin have in total?,Mia has 6 packages. Each package that Mia has contains 8 suitcases. Mia has 3 more suitcases than Benjamin. Benjamin bought 3 more suitcases. There are 4 rolls of toilet paper in each of Benjamin's suitcases. How many rolls of toilet paper does Benjamin have in total?,192
How many keyboards does Grace have?,Benjamin owns 2 backpacks. Grace has 18 more backpacks than Benjamin. Each of Grace's backpack has 2 boxs. Every box that Grace has contains 3 keyboards.,Benjamin owns 2 backpacks. Benjamin has 18 fewer backpacks than Grace. Each of Grace's backpack has 2 boxs. Every box that Grace has contains 3 keyboards.,Benjamin owns 2 backpacks. Grace has 18 more backpacks than Benjamin. Each of Grace's backpacks has 2 boxes. Every box that Grace has contains 3 keyboards. How many keyboards does Grace have?,Benjamin owns 2 backpacks. Benjamin has 18 fewer backpacks than Grace. Each of Grace's backpacks has 2 boxes. Every box that Grace has contains 3 keyboards. How many keyboards does Grace have?,120
How many kilograms of gold does Sophia have?,Christian has 11 suitcases. Christian possesses 8 kilograms of gold per suitcase. Sophia has 2 times as much gold in kilograms as Christian does.,Christian has 11 suitcases. Christian possesses 8 kilograms of gold per suitcase. Christian has 1/2 as much gold in kilograms as Sophia does.,Christian has 11 suitcases. Each suitcase possesses 8 kilograms of gold. Sophia has twice as much gold in kilograms as Christian does. How many kilograms of gold does Sophia have?,Christian has 11 suitcases. Each suitcase possesses 8 kilograms of gold. Christian has half as much gold in kilograms as Sophia does. How many kilograms of gold does Sophia have?,176
What is the number of green vacuum cleaners that Jacob has?,Jonathan has 5 green vacuum cleaners. Jonathan bought 5 green vacuum cleaners. Jacob has 9 more green vacuum cleaners than Jonathan.,Jonathan has 5 green vacuum cleaners. Jonathan bought 5 green vacuum cleaners. Jonathan has 9 fewer green vacuum cleaners than Jacob.,Jonathan has 5 green vacuum cleaners. Jonathan bought 5 more green vacuum cleaners. Jacob has 9 more green vacuum cleaners than Jonathan. What is the number of green vacuum cleaners that Jacob has?,Jonathan has 5 green vacuum cleaners. Jonathan bought 5 more green vacuum cleaners. Jonathan has 9 fewer green vacuum cleaners than Jacob. What is the number of green vacuum cleaners that Jacob has?,19
What is the number of red towels that Jonathan has?,John has 2 green baskets.  Jonathan has 11 times the amount of green baskets compared to the amount John has. Jonathan bought 7 green baskets. Jonathan possesses 13 red towel for every green basket.,John has 2 green baskets.  John has 1/11 the amount of green baskets compared to the amount Jonathan has. Jonathan bought 7 green baskets. Jonathan possesses 13 red towel for every green basket.,John has 2 green baskets. Jonathan has 11 times the number of green baskets that John has. Jonathan bought 7 green baskets. Jonathan possesses 13 red towels for every green basket. What is the number of red towels that Jonathan has?,John has 2 green baskets. John has 1/11 the number of green baskets compared to the number Jonathan has. Jonathan bought 7 green baskets. Jonathan possesses 13 red towels for every green basket. What is the number of red towels that Jonathan has?,377
How many acres of farmland does Lucy have?,Natalie has 18 acres of farmland. Lucy has 16 acres of farmland more than Natalie.,Natalie has 18 acres of farmland. Natalie has 16 acres of farmland less than Lucy.,Natalie has 18 acres of farmland. Lucy has 16 more acres of farmland than Natalie. How many acres of farmland does Lucy have?,Natalie has 18 acres of farmland. Natalie has 16 acres less farmland than Lucy. How many acres of farmland does Lucy have?,34
How many rugs does Mia have in all?,There are 9 packages in Grace's collection. Each of Grace's package holds 12 rugs. Grace bought 16 rugs. Mia has 19 more rugs than Grace.,There are 9 packages in Grace's collection. Each of Grace's package holds 12 rugs. Grace bought 16 rugs. Grace has 19 fewer rugs than Mia.,There are 9 packages in Grace's collection. Each package holds 12 rugs. Grace bought 16 rugs. Mia has 19 more rugs than Grace. How many rugs does Mia have in total?,There are 9 packages in Grace's collection. Each package holds 12 rugs. Grace bought 16 rugs. Grace has 19 fewer rugs than Mia. How many rugs does Mia have in total?,143
