question,consistent body,inconsistent body,consistent paraphrased,inconsistent paraphrased,answer
How many tables does Elizabeth have totaled?,Emily owns 11 suitcases. Each of Emily's suitcase has 7 tables. Emily bought 19 tables. Elizabeth has 10 times as many tables as Emily.,Emily owns 11 suitcases. Each of Emily's suitcase has 7 tables. Emily bought 19 tables. Emily has 1/10 the amount of tables as Elizabeth.,Emily owns 11 suitcases. Each of Emily's suitcases has 7 tables. Emily bought 19 tables. Elizabeth has 10 times as many tables as Emily. How many tables does Elizabeth have in total?,Emily owns 11 suitcases. Each of Emily's suitcases has 7 tables. Emily bought 19 tables. Emily has 1/10 the number of tables as Elizabeth. How many tables does Elizabeth have in total?,960
How many backpacks does Jonathan have in all now?,Joseph has 20 backpacks. Joseph bought 7 more backpacks. Each of Joseph's backpack has 11 bowls. Jonathan has 1/3 the amount of backpacks as Joseph. Jonathan bought 17 more backpacks. Jonathan bought 20 more backpacks.,Joseph has 20 backpacks. Joseph bought 7 more backpacks. Each of Joseph's backpack has 11 bowls. Joseph has 3 times as many backpacks as Jonathan. Jonathan bought 17 more backpacks. Jonathan bought 20 more backpacks.,Joseph has 20 backpacks. Joseph bought 7 more backpacks. Each of Joseph's backpacks has 11 bowls. Jonathan has 1/3 the number of backpacks as Joseph. Jonathan bought 17 more backpacks. Jonathan bought 20 more backpacks. How many backpacks does Jonathan have in total now?,Joseph has 20 backpacks. Joseph bought 7 more backpacks. Each of Joseph's backpacks has 11 bowls. Joseph has 3 times as many backpacks as Jonathan. Jonathan bought 17 more backpacks. Jonathan bought 20 more backpacks. How many backpacks does Jonathan have in total now?,46
How many desks does Natalie have?,Avery has 15 desks. Avery bought 18 desks. Natalie has 16 fewer desks than Avery.,Avery has 15 desks. Avery bought 18 desks. Avery has 16 more desks than Natalie.,Avery has 15 desks. Avery bought 18 desks. Natalie has 16 fewer desks than Avery. How many desks does Natalie have?,Avery has 15 desks. Avery bought 18 desks. Avery has 16 more desks than Natalie. How many desks does Natalie have?,17
How many watchs does Emma have in all now?,Elijah has 8 watchs. Elijah bought 9 watchs. Emma has 17 fewer watchs than Elijah. Emma bought 12 watchs. Emma bought 8 watchs.,Elijah has 8 watchs. Elijah bought 9 watchs. Elijah has 17 more watchs than Emma. Emma bought 12 watchs. Emma bought 8 watchs.,Elijah has 8 watches. Elijah bought 9 watches. Emma has 17 fewer watches than Elijah. Emma bought 12 watches. Emma bought 8 watches. How many watches does Emma have in total now?,Elijah has 8 watches. Elijah bought 9 watches. Elijah has 17 more watches than Emma. Emma bought 12 watches. Emma bought 8 watches. How many watches does Emma have in total now?,20
How many gallons of oil does Samuel have?,Grace has 16 boxs. Grace bought 16 more boxs. Samuel has 1/16 the amount of boxs as Grace. Samuel possesses 18 gallons of oil per box.,Grace has 16 boxs. Grace bought 16 more boxs. Grace has 16 times as many boxs as Samuel. Samuel possesses 18 gallons of oil per box.,Grace has 16 boxes. Grace bought 16 more boxes. Samuel has 1/16th the amount of boxes as Grace. Samuel possesses 18 gallons of oil per box. How many gallons of oil does Samuel have?,Grace has 16 boxes. Grace bought 16 more boxes. Grace has 16 times as many boxes as Samuel. Samuel possesses 18 gallons of oil per box. How many gallons of oil does Samuel have?,36
What is the number of blue vases that Amelia has now?,Avery has 16 blue vases.  Amelia has 1/2 the amount of blue vases compared to the amount Avery has. Amelia bought 11 blue vases. Amelia bought 10 blue vases.,Avery has 16 blue vases.  Avery has 2 times the amount of blue vases compared to the amount Amelia has. Amelia bought 11 blue vases. Amelia bought 10 blue vases.,Avery has 16 blue vases. Amelia has half the number of blue vases compared to Avery. Amelia bought 11 blue vases. Amelia bought 10 blue vases. What is the number of blue vases that Amelia has now?,Avery has 16 blue vases. Avery has twice the number of blue vases compared to Amelia. Amelia bought 11 blue vases. Amelia bought 10 blue vases. What is the number of blue vases that Amelia has now?,29
How many beds does James have in their collection?,Charlotte has 12 beds. James has 8 fewer beds than Charlotte.,Charlotte has 12 beds. Charlotte has 8 more beds than James.,Charlotte has 12 beds. James has 8 fewer beds than Charlotte. How many beds does James have in his collection?,Charlotte has 12 beds. She has 8 more beds than James. How many beds does James have in his collection?,4
How many gigabytes of training data does Abigail have?,There are 18 backpacks in Victoria's collection. Abigail has 2 fewer backpacks than Victoria. Abigail bought 2 more backpacks. Abigail possesses 5 gigabytes of training data per backpack.,There are 18 backpacks in Victoria's collection. Victoria has 2 more backpacks than Abigail. Abigail bought 2 more backpacks. Abigail possesses 5 gigabytes of training data per backpack.,There are 18 backpacks in Victoria's collection. Abigail has 2 fewer backpacks than Victoria. Abigail bought 2 more backpacks. Abigail possesses 5 gigabytes of training data per backpack. How many gigabytes of training data does Abigail have?,There are 18 backpacks in Victoria's collection. Victoria has 2 more backpacks than Abigail. Abigail bought 2 more backpacks. Abigail possesses 5 gigabytes of training data per backpack. How many gigabytes of training data does Abigail have?,90
How many keys does Grace have in their collection now?,Joshua has 8 keys. Joshua bought 19 keys. Grace has 10 fewer keys than Joshua. Grace bought 10 keys.,Joshua has 8 keys. Joshua bought 19 keys. Joshua has 10 more keys than Grace. Grace bought 10 keys.,Joshua has 8 keys. Joshua bought 19 keys. Grace has 10 fewer keys than Joshua. Grace bought 10 keys. How many keys does Grace have in her collection now?,Joshua has 8 keys. Joshua bought 19 keys. Joshua has 10 more keys than Grace. Grace bought 10 keys. How many keys does Grace have in her collection now?,27
How many chairs does Natalie have in all?,Scarlett has 20 chairs. Scarlett bought 15 chairs. Natalie has 14 times as many chairs as Scarlett.,Scarlett has 20 chairs. Scarlett bought 15 chairs. Scarlett has 1/14 the amount of chairs as Natalie.,Scarlett has 20 chairs. Scarlett bought 15 chairs. Natalie has 14 times as many chairs as Scarlett. How many chairs does Natalie have in total?,Scarlett has 20 chairs. Scarlett bought 15 chairs. Scarlett has 1/14 of the amount of chairs as Natalie. How many chairs does Natalie have in total?,490
How many mirrors does Alexander have totaled now?,Amelia has 12 bags. Amelia bought 4 bags. Alexander has 3 times as many bags as Amelia. Each of Alexander's bag has 11 mirrors. Alexander bought 12 mirrors.,Amelia has 12 bags. Amelia bought 4 bags. Amelia has 1/3 the amount of bags as Alexander. Each of Alexander's bag has 11 mirrors. Alexander bought 12 mirrors.,Amelia has 12 bags. Amelia bought 4 bags. Alexander has 3 times as many bags as Amelia. Each of Alexander's bags has 11 mirrors. Alexander bought 12 mirrors. How many mirrors does Alexander have in total now?,Amelia has 12 bags. Amelia bought 4 bags. Amelia has 1/3 of the number of bags as Alexander. Each of Alexander's bags has 11 mirrors. Alexander bought 12 mirrors. How many mirrors does Alexander have in total now?,540
How many gigabytes of training data does Elizabeth have now?,Harper has 12 gigabytes of training data. Elizabeth has 1/6 as much training data in gigabytes as Harper does. Elizabeth bought 6 gigabytes more training data.,Harper has 12 gigabytes of training data. Harper has 6 times as much training data in gigabytes as Elizabeth does. Elizabeth bought 6 gigabytes more training data.,Harper has 12 gigabytes of training data. Elizabeth has 1/6 as much training data in gigabytes as Harper does. Elizabeth bought 6 gigabytes more training data. How many gigabytes of training data does Elizabeth have now?,Harper has 12 gigabytes of training data. Harper has 6 times as much training data in gigabytes as Elizabeth does. Elizabeth bought 6 gigabytes more training data. How many gigabytes of training data does Elizabeth have now?,8
How many liters of milk does Harper have now?,Olivia owns 10 backpacks. Olivia bought 6 more backpacks. Olivia possesses 3 liters of milk per backpack. Harper has 5 times as much milk in liters as Olivia does. Harper bought 11 liters more milk.,Olivia owns 10 backpacks. Olivia bought 6 more backpacks. Olivia possesses 3 liters of milk per backpack. Olivia has 1/5 as much milk in liters as Harper does. Harper bought 11 liters more milk.,Olivia owns 10 backpacks. Olivia bought 6 additional backpacks. Olivia possesses 3 liters of milk per backpack. Harper has 5 times as much milk in liters as Olivia does. Harper bought 11 more liters of milk. How many liters of milk does Harper have now?,Olivia owns 10 backpacks. Olivia bought 6 additional backpacks. Olivia possesses 3 liters of milk per backpack. Olivia has 1/5 as much milk in liters as Harper does. Harper bought 11 more liters of milk. How many liters of milk does Harper have now?,251
What is the number of orange towels that Grace has now?,Andrew has 20 orange towels. Grace has 3 fewer orange towels than Andrew. Grace bought 2 orange towels.,Andrew has 20 orange towels. Andrew has 3 more orange towels than Grace. Grace bought 2 orange towels.,Andrew has 20 orange towels. Grace has 3 fewer orange towels than Andrew. Grace bought 2 orange towels. What is the number of orange towels that Grace has now?,Andrew has 20 orange towels. Andrew has 3 more orange towels than Grace. Grace bought 2 orange towels. What is the number of orange towels that Grace has now?,19
What is the number of green mouses that Joshua has?,Victoria has 4 green mouses. Joshua has 3 fewer green mouses than Victoria.,Victoria has 4 green mouses. Victoria has 3 more green mouses than Joshua.,Victoria has 4 green mice. Joshua has 3 fewer green mice than Victoria. What is the number of green mice that Joshua has?,Victoria has 4 green mice. Victoria has 3 more green mice than Joshua. What is the number of green mice that Joshua has?,1
What is the number of yellow bags that Natalie has now?,Amelia has 17 yellow bags. Amelia possesses 8 orange watch for every yellow bag. Natalie has 18 more yellow bags than Amelia. Natalie bought 5 yellow bags. Natalie bought 3 yellow bags.,Amelia has 17 yellow bags. Amelia possesses 8 orange watch for every yellow bag. Amelia has 18 fewer yellow bags than Natalie. Natalie bought 5 yellow bags. Natalie bought 3 yellow bags.,Amelia has 17 yellow bags. Amelia possesses 8 orange watches for every yellow bag. Natalie has 18 more yellow bags than Amelia. Natalie bought 5 yellow bags. Natalie bought 3 more yellow bags. What is the number of yellow bags that Natalie has now?,Amelia has 17 yellow bags. Amelia possesses 8 orange watches for every yellow bag. Amelia has 18 fewer yellow bags than Natalie. Natalie bought 5 yellow bags. Natalie bought 3 more yellow bags. What is the number of yellow bags that Natalie has now?,43
How many couchs does Ava have in their collection now?,Nicholas owns 17 baskets. Each of Nicholas's basket holds 13 umbrellas. Nicholas bought 9 more umbrellas. Ava has 2 fewer baskets than Nicholas. Each of Ava's basket holds 5 couchs. Ava bought 13 couchs.,Nicholas owns 17 baskets. Each of Nicholas's basket holds 13 umbrellas. Nicholas bought 9 more umbrellas. Nicholas has 2 more baskets than Ava. Each of Ava's basket holds 5 couchs. Ava bought 13 couchs.,Nicholas owns 17 baskets. Each of Nicholas's baskets holds 13 umbrellas. Nicholas bought 9 more umbrellas. Ava has 2 fewer baskets than Nicholas. Each of Ava's baskets holds 5 couches. Ava bought 13 couches. How many couches does Ava have in their collection now?,Nicholas owns 17 baskets. Each of Nicholas's baskets holds 13 umbrellas. Nicholas bought 9 more umbrellas. Nicholas has 2 more baskets than Ava. Each of Ava's baskets holds 5 couches. Ava bought 13 couches. How many couches does Ava have in their collection now?,88
How many kilowatt-hours of emergency energy reserve does Christopher have now?,Joseph owns 2 boxs. Joseph possesses 20 kilowatt-hours of emergency energy reserve per box. Christopher has 1/5 as much emergency energy reserve in kilowatt-hours as Joseph does. Christopher bought 5 kilowatt-hours more emergency energy reserve.,Joseph owns 2 boxs. Joseph possesses 20 kilowatt-hours of emergency energy reserve per box. Joseph has 5 times as much emergency energy reserve in kilowatt-hours as Christopher does. Christopher bought 5 kilowatt-hours more emergency energy reserve.,Joseph owns 2 boxes. Joseph possesses 20 kilowatt-hours of emergency energy reserve per box. Christopher has 1/5 as much emergency energy reserve in kilowatt-hours as Joseph does. Christopher bought 5 kilowatt-hours more emergency energy reserve. How many kilowatt-hours of emergency energy reserve does Christopher have now?,Joseph owns 2 boxes. Joseph possesses 20 kilowatt-hours of emergency energy reserve per box. Joseph has 5 times as much emergency energy reserve in kilowatt-hours as Christopher does. Christopher bought 5 kilowatt-hours more emergency energy reserve. How many kilowatt-hours of emergency energy reserve does Christopher have now?,13
How many dollars of bitcoin does Lily have now?,John has 2 dollars of bitcoin. Lily has 15 dollars of bitcoin more than John. Lily bought 4 dollars more bitcoin.,John has 2 dollars of bitcoin. John has 15 dollars of bitcoin less than Lily. Lily bought 4 dollars more bitcoin.,John has 2 dollars of bitcoin. Lily has 15 dollars more bitcoin than John. Lily bought 4 dollars more bitcoin. How many dollars of bitcoin does Lily have now?,John has 2 dollars of bitcoin. John has 15 dollars less of bitcoin than Lily. Lily bought 4 dollars more bitcoin. How many dollars of bitcoin does Lily have now?,21
How many headphones does Ryan have in their collection?,There are 4 packages in Layla's collection. Each of Layla's package holds 12 boxs. Ryan has 1/3 the amount of boxs as Layla. Ryan bought 6 more boxs. There are 20 headphones in every Ryan's box.,There are 4 packages in Layla's collection. Each of Layla's package holds 12 boxs. Layla has 3 times as many boxs as Ryan. Ryan bought 6 more boxs. There are 20 headphones in every Ryan's box.,There are 4 packages in Layla's collection. Each of Layla's packages holds 12 boxes. Ryan has 1/3 the amount of boxes as Layla. Ryan bought 6 more boxes. There are 20 headphones in every one of Ryan's boxes. How many headphones does Ryan have in their collection?,There are 4 packages in Layla's collection. Each of Layla's packages holds 12 boxes. Layla has 3 times as many boxes as Ryan. Ryan bought 6 more boxes. There are 20 headphones in every one of Ryan's boxes. How many headphones does Ryan have in their collection?,440
How many rolls of toilet papers does Sophia have in their collection?,Nicholas has 4 rolls of toilet papers. Sophia has 5 times as many rolls of toilet papers as Nicholas.,Nicholas has 4 rolls of toilet papers. Nicholas has 1/5 the amount of rolls of toilet papers as Sophia.,Nicholas has 4 rolls of toilet paper. Sophia has 5 times as many rolls of toilet paper as Nicholas. How many rolls of toilet paper does Sophia have in her collection?,Nicholas has 4 rolls of toilet paper. Nicholas has 1/5 the number of rolls of toilet paper as Sophia. How many rolls of toilet paper does Sophia have in her collection?,20
What is the number of green spoons that Christian has now?,Sofia has 16 green spoons.  Christian has 1/8 the amount of green spoons compared to the amount Sofia has. Christian bought 16 green spoons.,Sofia has 16 green spoons.  Sofia has 8 times the amount of green spoons compared to the amount Christian has. Christian bought 16 green spoons.,Sofia has 16 green spoons. Christian has 1/8 of the amount of green spoons that Sofia has. Christian bought 16 green spoons. What is the number of green spoons that Christian has now?,Sofia has 16 green spoons. Sofia has 8 times the number of green spoons that Christian has. Christian bought 16 green spoons. What is the number of green spoons that Christian has now?,18
How many liters of milk does Nathan have now?,Christian has 19 liters of milk. Nathan has 19 liters of milk less than Christian. Nathan bought 18 liters more milk. Nathan bought 2 liters more milk.,Christian has 19 liters of milk. Christian has 19 liters of milk more than Nathan. Nathan bought 18 liters more milk. Nathan bought 2 liters more milk.,Christian has 19 liters of milk. Nathan has 19 liters less milk than Christian. Nathan bought 18 liters more milk. Nathan bought 2 liters more milk. How many liters of milk does Nathan have now?,Christian has 19 liters of milk. Christian has 19 liters more milk than Nathan. Nathan bought 18 liters more milk. Nathan bought 2 liters more milk. How many liters of milk does Nathan have now?,20
How many baskets does Mila have totaled now?,There are 8 boxs in Sofia's collection. There are 6 baskets in every Sofia's box. Every basket that Sofia has contains 2 televisions. Mila has 1/16 the amount of baskets as Sofia. Mila bought 12 baskets.,There are 8 boxs in Sofia's collection. There are 6 baskets in every Sofia's box. Every basket that Sofia has contains 2 televisions. Sofia has 16 times as many baskets as Mila. Mila bought 12 baskets.,There are 8 boxes in Sofia's collection. There are 6 baskets in every box of Sofia's. Every basket that Sofia has contains 2 televisions. Mila has 1/16 of the amount of baskets as Sofia. Mila bought 12 baskets. How many baskets does Mila have in total now?,There are 8 boxes in Sofia's collection. There are 6 baskets in every box of Sofia's. Every basket that Sofia has contains 2 televisions. Sofia has 16 times as many baskets as Mila. Mila bought 12 baskets. How many baskets does Mila have in total now?,15
How many blenders does John have in all now?,Victoria has 12 boxs. Each of Victoria's box holds 9 packages. Each of Victoria's package has 8 blenders. John has 1/18 the amount of blenders as Victoria. John bought 7 blenders.,Victoria has 12 boxs. Each of Victoria's box holds 9 packages. Each of Victoria's package has 8 blenders. Victoria has 18 times as many blenders as John. John bought 7 blenders.,Victoria has 12 boxes. Each of Victoria's boxes holds 9 packages. Each of Victoria's packages has 8 blenders. John has 1/18 the amount of blenders as Victoria. John bought 7 blenders. How many blenders does John have in all now?,Victoria has 12 boxes. Each of Victoria's boxes holds 9 packages. Each of Victoria's packages has 8 blenders. Victoria has 18 times as many blenders as John. John bought 7 blenders. How many blenders does John have in all now?,55
How many wallets does Grace have now?,Scarlett owns 17 backpacks. Each of Scarlett's backpack holds 3 wallets. Grace has 16 more wallets than Scarlett. Grace bought 15 more wallets.,Scarlett owns 17 backpacks. Each of Scarlett's backpack holds 3 wallets. Scarlett has 16 fewer wallets than Grace. Grace bought 15 more wallets.,Scarlett owns 17 backpacks. Each of Scarlett's backpacks holds 3 wallets. Grace has 16 more wallets than Scarlett. Grace bought 15 more wallets. How many wallets does Grace have now?,Scarlett owns 17 backpacks. Each of Scarlett's backpacks holds 3 wallets. Scarlett has 16 fewer wallets than Grace. Grace bought 15 more wallets. How many wallets does Grace have now?,82
What is the number of red desks that Natalie has now?,Andrew has 16 orange suitcases. Natalie has 20 more orange suitcases than Andrew. Natalie possesses 3 red desk for every orange suitcase. Natalie bought 2 red desks.,Andrew has 16 orange suitcases. Andrew has 20 fewer orange suitcases than Natalie. Natalie possesses 3 red desk for every orange suitcase. Natalie bought 2 red desks.,Andrew has 16 orange suitcases. Natalie has 20 more orange suitcases than Andrew. Natalie possesses 3 red desks for every orange suitcase. Natalie bought 2 red desks. What is the number of red desks that Natalie has now?,Andrew has 16 orange suitcases. Andrew has 20 fewer orange suitcases than Natalie. Natalie possesses 3 red desks for every orange suitcase. Natalie bought 2 red desks. What is the number of red desks that Natalie has now?,110
What is the number of red wallets that Amelia has?,Mason has 20 large bags. Mason possesses 14 small box for every large bag. Mason possesses 3 red wallet for every small box. Amelia has 6 fewer red wallets than Mason.,Mason has 20 large bags. Mason possesses 14 small box for every large bag. Mason possesses 3 red wallet for every small box. Mason has 6 more red wallets than Amelia.,Mason has 20 large bags. Mason possesses 14 small boxes for every large bag. Mason possesses 3 red wallets for every small box. Amelia has 6 fewer red wallets than Mason. What is the number of red wallets that Amelia has?,Mason has 20 large bags. Mason possesses 14 small boxes for every large bag. Mason possesses 3 red wallets for every small box. Mason has 6 more red wallets than Amelia. What is the number of red wallets that Amelia has?,834
How many desks does Elijah have in their collection?,There are 9 boxs in Ryan's collection. Each of Ryan's box holds 15 packages. Each of Ryan's package holds 2 washing machines. Elijah has 1/9 the amount of boxs as Ryan. Each of Elijah's box has 19 desks.,There are 9 boxs in Ryan's collection. Each of Ryan's box holds 15 packages. Each of Ryan's package holds 2 washing machines. Ryan has 9 times as many boxs as Elijah. Each of Elijah's box has 19 desks.,There are 9 boxes in Ryan's collection. Each of Ryan's boxes holds 15 packages. Each of Ryan's packages holds 2 washing machines. Elijah has 1/9 the number of boxes as Ryan. Each of Elijah's boxes has 19 desks. How many desks does Elijah have in their collection?,There are 9 boxes in Ryan's collection. Each of Ryan's boxes holds 15 packages. Each of Ryan's packages holds 2 washing machines. Ryan has 9 times as many boxes as Elijah. Each of Elijah's boxes has 19 desks. How many desks does Elijah have in their collection?,19
How many grams of butter does Jacob have?,Ryan owns 10 packages. Every package that Ryan has contains 4 suitcases. Ryan possesses 17 gallons of oil per suitcase. Jacob has 10 more suitcases than Ryan. Jacob bought 16 more suitcases. Jacob possesses 14 grams of butter per suitcase.,Ryan owns 10 packages. Every package that Ryan has contains 4 suitcases. Ryan possesses 17 gallons of oil per suitcase. Ryan has 10 fewer suitcases than Jacob. Jacob bought 16 more suitcases. Jacob possesses 14 grams of butter per suitcase.,Ryan owns 10 packages. Each package that Ryan has contains 4 suitcases. Ryan possesses 17 gallons of oil per suitcase. Jacob has 10 more suitcases than Ryan. Jacob bought 16 more suitcases. Jacob possesses 14 grams of butter per suitcase. How many grams of butter does Jacob have?,Ryan owns 10 packages. Each package that Ryan has contains 4 suitcases. Ryan possesses 17 gallons of oil per suitcase. Ryan has 10 fewer suitcases than Jacob. Jacob bought 16 more suitcases. Jacob possesses 14 grams of butter per suitcase. How many grams of butter does Jacob have?,924
What is the number of green cups that Christian has now?,Ava has 12 green cups. Ava bought 2 green cups.  Christian has 8 times the amount of green cups compared to the amount Ava has. Christian bought 3 green cups.,Ava has 12 green cups. Ava bought 2 green cups.  Ava has 1/8 the amount of green cups compared to the amount Christian has. Christian bought 3 green cups.,Ava has 12 green cups. Ava bought 2 more green cups. Christian has 8 times the number of green cups that Ava has. Christian bought 3 more green cups. What is the total number of green cups that Christian has now?,Ava has 12 green cups. Ava bought 2 more green cups. Ava has 1/8 the number of green cups that Christian has. Christian bought 3 more green cups. What is the total number of green cups that Christian has now?,115
How many packages does Alexander have in all now?,There are 10 packages in Grace's collection. Each of Grace's package holds 13 televisions. Alexander has 1/2 the amount of packages as Grace. Alexander bought 20 packages.,There are 10 packages in Grace's collection. Each of Grace's package holds 13 televisions. Grace has 2 times as many packages as Alexander. Alexander bought 20 packages.,There are 10 packages in Grace's collection. Each of Grace's packages holds 13 televisions. Alexander has half the number of packages as Grace. Alexander bought 20 packages. How many packages does Alexander have in total now?,There are 10 packages in Grace's collection. Each of Grace's packages holds 13 televisions. Grace has 2 times as many packages as Alexander. Alexander bought 20 packages. How many packages does Alexander have in total now?,25
How many trash cans does Evelyn have in total?,Elijah has 16 baskets. Evelyn has 3 times as many baskets as Elijah. Evelyn bought 12 baskets. Each of Evelyn's basket holds 4 trash cans.,Elijah has 16 baskets. Elijah has 1/3 the amount of baskets as Evelyn. Evelyn bought 12 baskets. Each of Evelyn's basket holds 4 trash cans.,Elijah has 16 baskets. Evelyn has 3 times as many baskets as Elijah. Evelyn bought 12 baskets. Each of Evelyn's baskets holds 4 trash cans. How many trash cans does Evelyn have in total?,Elijah has 16 baskets. Elijah has 1/3 of the amount of baskets as Evelyn. Evelyn bought 12 baskets. Each of Evelyn's baskets holds 4 trash cans. How many trash cans does Evelyn have in total?,240
