question,consistent body,inconsistent body,consistent paraphrased,inconsistent paraphrased,answer
What is the number of blue sofas that Scarlett has?,Michael has 8 small bags. Michael bought 17 small bags. Michael bought 3 small bags. Scarlett has 14 fewer small bags than Michael. Scarlett possesses 11 blue sofa for every small bag.,Michael has 8 small bags. Michael bought 17 small bags. Michael bought 3 small bags. Michael has 14 more small bags than Scarlett. Scarlett possesses 11 blue sofa for every small bag.,Michael has 8 small bags. Michael bought 17 more small bags. Michael bought 3 additional small bags. Scarlett has 14 fewer small bags than Michael. Scarlett possesses 11 blue sofas for every small bag. What is the number of blue sofas that Scarlett has?,Michael has 8 small bags. Michael bought 17 more small bags. Michael bought 3 additional small bags. Michael has 14 more small bags than Scarlett. Scarlett possesses 11 blue sofas for every small bag. What is the number of blue sofas that Scarlett has?,154
How many mirrors does Natalie have in total?,Samuel owns 2 packages. Each of Samuel's package has 17 mirrors. Natalie has 6 more mirrors than Samuel.,Samuel owns 2 packages. Each of Samuel's package has 17 mirrors. Samuel has 6 fewer mirrors than Natalie.,Samuel owns 2 packages. Each of Samuel's packages has 17 mirrors. Natalie has 6 more mirrors than Samuel. How many mirrors does Natalie have in total?,Samuel owns 2 packages. Each of Samuel's packages has 17 mirrors. Samuel has 6 fewer mirrors than Natalie. How many mirrors does Natalie have in total?,40
What is the number of large rolls of toilet papers that Andrew has?,Alexander has 9 red backpacks. Alexander possesses 7 blue box for every red backpack. Alexander possesses 3 orange fork for every blue box.  Andrew has 1/9 the amount of blue boxs compared to the amount Alexander has. Andrew bought 4 blue boxs. Andrew possesses 12 large rolls of toilet paper for every blue box.,Alexander has 9 red backpacks. Alexander possesses 7 blue box for every red backpack. Alexander possesses 3 orange fork for every blue box.  Alexander has 9 times the amount of blue boxs compared to the amount Andrew has. Andrew bought 4 blue boxs. Andrew possesses 12 large rolls of toilet paper for every blue box.,Alexander has 9 red backpacks. Alexander possesses 7 blue boxes for every red backpack. Alexander possesses 3 orange forks for every blue box. Andrew has 1/9 the amount of blue boxes compared to the amount Alexander has. Andrew bought 4 blue boxes. Andrew possesses 12 large rolls of toilet paper for every blue box. What is the number of large rolls of toilet paper that Andrew has?,Alexander has 9 red backpacks. Alexander possesses 7 blue boxes for every red backpack. Alexander possesses 3 orange forks for every blue box. Alexander has 9 times the amount of blue boxes compared to the amount Andrew has. Andrew bought 4 blue boxes. Andrew possesses 12 large rolls of toilet paper for every blue box. What is the number of large rolls of toilet paper that Andrew has?,132
How many lamps does Christopher have?,Chloe owns 14 backpacks. Christopher has 12 fewer backpacks than Chloe. Christopher bought 20 more backpacks. There are 10 lamps in every Christopher's backpack.,Chloe owns 14 backpacks. Chloe has 12 more backpacks than Christopher. Christopher bought 20 more backpacks. There are 10 lamps in every Christopher's backpack.,Chloe owns 14 backpacks. Christopher has 12 fewer backpacks than Chloe. Christopher bought 20 more backpacks. There are 10 lamps in every one of Christopher's backpacks. How many lamps does Christopher have?,Chloe owns 14 backpacks. Chloe has 12 more backpacks than Christopher. Christopher bought 20 more backpacks. There are 10 lamps in every one of Christopher's backpacks. How many lamps does Christopher have?,220
What is the number of large headphones that David has?,Emily has 8 small bags. Emily bought 19 small bags. Emily possesses 10 orange box for every small bag. David has 18 more orange boxs than Emily. David bought 3 orange boxs. David possesses 2 large headphone for every orange box.,Emily has 8 small bags. Emily bought 19 small bags. Emily possesses 10 orange box for every small bag. Emily has 18 fewer orange boxs than David. David bought 3 orange boxs. David possesses 2 large headphone for every orange box.,Emily has 8 small bags. Emily bought 19 small bags. Emily possesses 10 orange boxes for every small bag. David has 18 more orange boxes than Emily. David bought 3 orange boxes. David possesses 2 large headphones for every orange box. What is the number of large headphones that David has?,Emily has 8 small bags. Emily bought 19 small bags. Emily possesses 10 orange boxes for every small bag. Emily has 18 fewer orange boxes than David. David bought 3 orange boxes. David possesses 2 large headphones for every orange box. What is the number of large headphones that David has?,582
How many dollars of bitcoin does John have?,Henry owns 12 boxs. There are 2 backpacks in every Henry's box. Henry possesses 7 liters of milk per backpack. John has 3 more backpacks than Henry. John possesses 14 dollars of bitcoin per backpack.,Henry owns 12 boxs. There are 2 backpacks in every Henry's box. Henry possesses 7 liters of milk per backpack. Henry has 3 fewer backpacks than John. John possesses 14 dollars of bitcoin per backpack.,Henry owns 12 boxes. There are 2 backpacks in each of Henry's boxes. Henry possesses 7 liters of milk per backpack. John has 3 more backpacks than Henry. John possesses 14 dollars of bitcoin per backpack. How many dollars of bitcoin does John have?,Henry owns 12 boxes. There are 2 backpacks in each of Henry's boxes. Henry possesses 7 liters of milk per backpack. Henry has 3 fewer backpacks than John. John possesses 14 dollars of bitcoin per backpack. How many dollars of bitcoin does John have?,378
What is the number of green cups that Christopher has?,Andrew has 7 green cups.  Christopher has 16 times the amount of green cups compared to the amount Andrew has.,Andrew has 7 green cups.  Andrew has 1/16 the amount of green cups compared to the amount Christopher has.,Andrew has 7 green cups. Christopher has 16 times the number of green cups that Andrew has. What is the number of green cups that Christopher has?,Andrew has 7 green cups. Andrew has 1/16 of the amount of green cups compared to the amount Christopher has. What is the number of green cups that Christopher has?,112
What is the number of small bottles that Evelyn has now?,Christopher has 13 green baskets. Evelyn has 9 fewer green baskets than Christopher. Evelyn possesses 20 small bottle for every green basket. Evelyn bought 4 small bottles.,Christopher has 13 green baskets. Christopher has 9 more green baskets than Evelyn. Evelyn possesses 20 small bottle for every green basket. Evelyn bought 4 small bottles.,Christopher has 13 green baskets. Evelyn has 9 fewer green baskets than Christopher. Evelyn possesses 20 small bottles for every green basket. Evelyn bought 4 small bottles. What is the number of small bottles that Evelyn has now?,Christopher has 13 green baskets. Christopher has 9 more green baskets than Evelyn. Evelyn possesses 20 small bottles for every green basket. Evelyn bought 4 small bottles. What is the number of small bottles that Evelyn has now?,84
How many acres of farmland does Natalie have?,Logan has 12 acres of farmland. Logan bought 16 acres more farmland. Natalie has 1/7 as much farmland in acres as Logan does.,Logan has 12 acres of farmland. Logan bought 16 acres more farmland. Logan has 7 times as much farmland in acres as Natalie does.,Logan has 12 acres of farmland. Logan bought 16 more acres of farmland. Natalie has 1/7 as much farmland in acres as Logan does. How many acres of farmland does Natalie have?,Logan has 12 acres of farmland. Logan bought 16 more acres of farmland. Logan has 7 times as much farmland in acres as Natalie does. How many acres of farmland does Natalie have?,4
What is the number of orange toasters that William has?,Liam has 12 large boxs. Liam bought 2 large boxs. William has 10 fewer large boxs than Liam. William possesses 2 blue package for every large box. William possesses 10 orange toaster for every blue package.,Liam has 12 large boxs. Liam bought 2 large boxs. Liam has 10 more large boxs than William. William possesses 2 blue package for every large box. William possesses 10 orange toaster for every blue package.,Liam has 12 large boxes. Liam bought 2 large boxes. William has 10 fewer large boxes than Liam. William possesses 2 blue packages for every large box. William possesses 10 orange toasters for every blue package. What is the number of orange toasters that William has?,Liam has 12 large boxes. Liam bought 2 large boxes. Liam has 10 more large boxes than William. William possesses 2 blue packages for every large box. William possesses 10 orange toasters for every blue package. What is the number of orange toasters that William has?,80
How many dollars of bitcoin does Matthew have?,Samuel has 9 suitcases. Matthew has 16 times as many suitcases as Samuel. Matthew bought 3 more suitcases. Matthew possesses 4 dollars of bitcoin per suitcase.,Samuel has 9 suitcases. Samuel has 1/16 the amount of suitcases as Matthew. Matthew bought 3 more suitcases. Matthew possesses 4 dollars of bitcoin per suitcase.,Samuel has 9 suitcases. Matthew has 16 times as many suitcases as Samuel. Matthew bought 3 more suitcases. Matthew possesses 4 dollars of bitcoin per suitcase. How many dollars of bitcoin does Matthew have?,Samuel has 9 suitcases. Samuel has 1/16th the number of suitcases as Matthew. Matthew bought 3 more suitcases. Matthew possesses 4 dollars of bitcoin per suitcase. How many dollars of bitcoin does Matthew have?,588
What is the number of small beds that Liam has?,Daniel has 10 yellow bags.  Liam has 1/5 the amount of yellow bags compared to the amount Daniel has. Liam possesses 4 large backpack for every yellow bag. Liam possesses 17 small bed for every large backpack.,Daniel has 10 yellow bags.  Daniel has 5 times the amount of yellow bags compared to the amount Liam has. Liam possesses 4 large backpack for every yellow bag. Liam possesses 17 small bed for every large backpack.,Daniel has 10 yellow bags. Liam has 1/5 the number of yellow bags that Daniel has. Liam possesses 4 large backpacks for every yellow bag. Liam possesses 17 small beds for every large backpack. What is the number of small beds that Liam has?,Daniel has 10 yellow bags. Daniel has 5 times the number of yellow bags compared to the number Liam has. Liam possesses 4 large backpacks for every yellow bag. Liam possesses 17 small beds for every large backpack. What is the number of small beds that Liam has?,136
How many dollars of bitcoin does Sophia have?,There are 2 suitcases in Olivia's collection. Sophia has 2 times as many suitcases as Olivia. Sophia possesses 11 dollars of bitcoin per suitcase.,There are 2 suitcases in Olivia's collection. Olivia has 1/2 the amount of suitcases as Sophia. Sophia possesses 11 dollars of bitcoin per suitcase.,There are 2 suitcases in Olivia's collection. Sophia has twice as many suitcases as Olivia. Sophia possesses 11 dollars of bitcoin per suitcase. How many dollars of bitcoin does Sophia have?,There are 2 suitcases in Olivia's collection. Olivia has half the number of suitcases as Sophia. Sophia possesses 11 dollars of bitcoin per suitcase. How many dollars of bitcoin does Sophia have?,44
How many grams of butter does David have now?,Amelia owns 6 packages. Amelia bought 19 packages. David has 7 fewer packages than Amelia. David possesses 5 grams of butter per package. David bought 19 grams more butter.,Amelia owns 6 packages. Amelia bought 19 packages. Amelia has 7 more packages than David. David possesses 5 grams of butter per package. David bought 19 grams more butter.,Amelia owns 6 packages. Amelia bought 19 packages. David has 7 fewer packages than Amelia. David possesses 5 grams of butter per package. David bought 19 grams more butter. How many grams of butter does David have now?,Amelia owns 6 packages. Amelia bought 19 packages. Amelia has 7 more packages than David. David possesses 5 grams of butter per package. David bought 19 grams more butter. How many grams of butter does David have now?,109
What is the number of large chairs that Henry has?,Lily has 3 large chairs. Lily bought 11 large chairs. Henry has 16 more large chairs than Lily.,Lily has 3 large chairs. Lily bought 11 large chairs. Lily has 16 fewer large chairs than Henry.,Lily has 3 large chairs. Lily bought 11 large chairs. Henry has 16 more large chairs than Lily. What is the number of large chairs that Henry has?,Lily has 3 large chairs. Lily bought 11 large chairs. Lily has 16 fewer large chairs than Henry. What is the number of large chairs that Henry has?,30
How many dollars of bitcoin does Sofia have?,There are 17 baskets in Nathan's collection. There are 2 boxs in every Nathan's basket. Sofia has 13 fewer boxs than Nathan. There are 3 bags in every Sofia's box. Sofia possesses 2 dollars of bitcoin per bag.,There are 17 baskets in Nathan's collection. There are 2 boxs in every Nathan's basket. Nathan has 13 more boxs than Sofia. There are 3 bags in every Sofia's box. Sofia possesses 2 dollars of bitcoin per bag.,There are 17 baskets in Nathan's collection. There are 2 boxes in every one of Nathan's baskets. Sofia has 13 fewer boxes than Nathan. There are 3 bags in every one of Sofia's boxes. Sofia possesses 2 dollars of bitcoin per bag. How many dollars of bitcoin does Sofia have?,There are 17 baskets in Nathan's collection. There are 2 boxes in every one of Nathan's baskets. Nathan has 13 more boxes than Sofia. There are 3 bags in every one of Sofia's boxes. Sofia possesses 2 dollars of bitcoin per bag. How many dollars of bitcoin does Sofia have?,126
How many acres of farmland does Ava have?,There are 17 packages in Victoria's collection. Victoria bought 13 packages. Victoria possesses 7 gigabytes of training data per package. Ava has 7 fewer packages than Victoria. There are 9 bags in every Ava's package. Ava possesses 4 acres of farmland per bag.,There are 17 packages in Victoria's collection. Victoria bought 13 packages. Victoria possesses 7 gigabytes of training data per package. Victoria has 7 more packages than Ava. There are 9 bags in every Ava's package. Ava possesses 4 acres of farmland per bag.,There are 17 packages in Victoria's collection. Victoria bought 13 packages. Victoria possesses 7 gigabytes of training data per package. Ava has 7 fewer packages than Victoria. There are 9 bags in each of Ava's packages. Ava possesses 4 acres of farmland per bag. How many acres of farmland does Ava have?,There are 17 packages in Victoria's collection. Victoria bought 13 packages. Victoria possesses 7 gigabytes of training data per package. Victoria has 7 more packages than Ava. There are 9 bags in each of Ava's packages. Ava possesses 4 acres of farmland per bag. How many acres of farmland does Ava have?,828
How many liters of milk does Chloe have?,Ryan has 16 liters of milk. Chloe has 11 liters of milk less than Ryan.,Ryan has 16 liters of milk. Ryan has 11 liters of milk more than Chloe.,Ryan has 16 liters of milk. Chloe has 11 liters less than Ryan. How many liters of milk does Chloe have?,Ryan has 16 liters of milk. Ryan has 11 liters more milk than Chloe. How many liters of milk does Chloe have?,5
How many lamps does Joseph have in their collection?,Henry has 15 lamps. Joseph has 9 fewer lamps than Henry.,Henry has 15 lamps. Henry has 9 more lamps than Joseph.,Henry has 15 lamps. Joseph has 9 fewer lamps than Henry. How many lamps does Joseph have in his collection?,Henry has 15 lamps. Henry has 9 more lamps than Joseph. How many lamps does Joseph have in his collection?,6
How many acres of farmland does James have now?,There are 11 baskets in Lily's collection. Lily possesses 19 acres of farmland per basket. James has 7 acres of farmland more than Lily. James bought 11 acres more farmland.,There are 11 baskets in Lily's collection. Lily possesses 19 acres of farmland per basket. Lily has 7 acres of farmland less than James. James bought 11 acres more farmland.,There are 11 baskets in Lily's collection. Lily possesses 19 acres of farmland per basket. James has 7 acres more farmland than Lily. James bought 11 more acres of farmland. How many acres of farmland does James have now?,There are 11 baskets in Lily's collection. Lily possesses 19 acres of farmland per basket. Lily has 7 acres of farmland less than James. James bought 11 more acres of farmland. How many acres of farmland does James have now?,227
How many kilowatt-hours of emergency energy reserve does Lucy have now?,Emma has 17 kilowatt-hours of emergency energy reserve. Lucy has 9 times as much emergency energy reserve in kilowatt-hours as Emma does. Lucy bought 15 kilowatt-hours more emergency energy reserve.,Emma has 17 kilowatt-hours of emergency energy reserve. Emma has 1/9 as much emergency energy reserve in kilowatt-hours as Lucy does. Lucy bought 15 kilowatt-hours more emergency energy reserve.,Emma has 17 kilowatt-hours of emergency energy reserve. Lucy has 9 times as much emergency energy reserve in kilowatt-hours as Emma does. Lucy bought 15 kilowatt-hours more emergency energy reserve. How many kilowatt-hours of emergency energy reserve does Lucy have now?,Emma has 17 kilowatt-hours of emergency energy reserve. Emma has 1/9 as much emergency energy reserve in kilowatt-hours as Lucy does. Lucy bought 15 kilowatt-hours more emergency energy reserve. How many kilowatt-hours of emergency energy reserve does Lucy have now?,168
How many rolls of toilet papers does Jonathan have totaled?,Elizabeth owns 20 baskets. Elizabeth bought 5 baskets. Each of Elizabeth's basket has 10 rugs. Jonathan has 15 more baskets than Elizabeth. Jonathan bought 8 baskets. Each of Jonathan's basket has 14 rolls of toilet papers.,Elizabeth owns 20 baskets. Elizabeth bought 5 baskets. Each of Elizabeth's basket has 10 rugs. Elizabeth has 15 fewer baskets than Jonathan. Jonathan bought 8 baskets. Each of Jonathan's basket has 14 rolls of toilet papers.,Elizabeth owns 20 baskets. She bought 5 more baskets. Each of Elizabeth's baskets has 10 rugs. Jonathan has 15 more baskets than Elizabeth. He bought 8 more baskets. Each of Jonathan's baskets has 14 rolls of toilet paper. How many rolls of toilet paper does Jonathan have in total?,Elizabeth owns 20 baskets. She bought 5 more baskets. Each of Elizabeth's baskets has 10 rugs. Elizabeth has 15 fewer baskets than Jonathan. He bought 8 more baskets. Each of Jonathan's baskets has 14 rolls of toilet paper. How many rolls of toilet paper does Jonathan have in total?,672
How many gigabytes of training data does Harper have now?,Victoria has 13 gigabytes of training data. Harper has 1/13 as much training data in gigabytes as Victoria does. Harper bought 6 gigabytes more training data.,Victoria has 13 gigabytes of training data. Victoria has 13 times as much training data in gigabytes as Harper does. Harper bought 6 gigabytes more training data.,Victoria has 13 gigabytes of training data. Harper has 1/13 as much training data in gigabytes as Victoria does. Harper bought 6 gigabytes more training data. How many gigabytes of training data does Harper have now?,Victoria has 13 gigabytes of training data. She has 13 times as much training data in gigabytes as Harper does. Harper bought 6 gigabytes more training data. How many gigabytes of training data does Harper have now?,7
How many suitcases does Charlotte have now?,Sofia has 16 suitcases. Sofia bought 20 suitcases. There are 2 couchs in every Sofia's suitcase. Charlotte has 1/2 the amount of suitcases as Sofia. Charlotte bought 3 suitcases. Charlotte bought 19 suitcases.,Sofia has 16 suitcases. Sofia bought 20 suitcases. There are 2 couchs in every Sofia's suitcase. Sofia has 2 times as many suitcases as Charlotte. Charlotte bought 3 suitcases. Charlotte bought 19 suitcases.,Sofia has 16 suitcases. Sofia bought 20 more suitcases. There are 2 couches in each of Sofia's suitcases. Charlotte has half the number of suitcases as Sofia. Charlotte bought 3 more suitcases. Charlotte now has 19 suitcases. How many suitcases does Charlotte have now?,Sofia has 16 suitcases. Sofia bought 20 more suitcases. There are 2 couches in each of Sofia's suitcases. Sofia has twice as many suitcases as Charlotte. Charlotte bought 3 more suitcases. Charlotte now has 19 suitcases. How many suitcases does Charlotte have now?,40
How many kilowatt-hours of emergency energy reserve does Ava have?,Olivia owns 13 packages. Olivia bought 15 packages. Olivia bought 17 packages. Ava has 1/15 the amount of packages as Olivia. Ava bought 3 more packages. Ava possesses 11 kilowatt-hours of emergency energy reserve per package.,Olivia owns 13 packages. Olivia bought 15 packages. Olivia bought 17 packages. Olivia has 15 times as many packages as Ava. Ava bought 3 more packages. Ava possesses 11 kilowatt-hours of emergency energy reserve per package.,Olivia owns 13 packages. Olivia bought 15 more packages. Olivia bought 17 additional packages. Ava has 1/15th the number of packages as Olivia. Ava bought 3 more packages. Ava possesses 11 kilowatt-hours of emergency energy reserve per package. How many kilowatt-hours of emergency energy reserve does Ava have?,Olivia owns 13 packages. Olivia bought 15 more packages. Olivia bought 17 additional packages. Olivia has 15 times as many packages as Ava. Ava bought 3 more packages. Ava possesses 11 kilowatt-hours of emergency energy reserve per package. How many kilowatt-hours of emergency energy reserve does Ava have?,66
What is the number of small bowls that Benjamin has?,Natalie has 20 small bowls.  Benjamin has 1/10 the amount of small bowls compared to the amount Natalie has.,Natalie has 20 small bowls.  Natalie has 10 times the amount of small bowls compared to the amount Benjamin has.,Natalie has 20 small bowls. Benjamin has 1/10 of the number of small bowls that Natalie has. What is the number of small bowls that Benjamin has?,Natalie has 20 small bowls. Natalie has 10 times the number of small bowls that Benjamin has. What is the number of small bowls that Benjamin has?,2
How many hairdryers does Logan have in total?,There are 7 boxs in Daniel's collection. Daniel bought 7 boxs. Logan has 20 more boxs than Daniel. Every box that Logan has contains 3 bags. There are 7 hairdryers in every Logan's bag.,There are 7 boxs in Daniel's collection. Daniel bought 7 boxs. Daniel has 20 fewer boxs than Logan. Every box that Logan has contains 3 bags. There are 7 hairdryers in every Logan's bag.,There are 7 boxes in Daniel's collection. Daniel bought 7 boxes. Logan has 20 more boxes than Daniel. Every box that Logan has contains 3 bags. There are 7 hairdryers in every bag that Logan has. How many hairdryers does Logan have in total?,There are 7 boxes in Daniel's collection. Daniel bought 7 boxes. Daniel has 20 fewer boxes than Logan. Every box that Logan has contains 3 bags. There are 7 hairdryers in every bag that Logan has. How many hairdryers does Logan have in total?,714
What is the number of green televisions that Scarlett has?,Abigail has 5 large bags. Abigail bought 12 large bags.  Scarlett has 2 times the amount of large bags compared to the amount Abigail has. Scarlett bought 8 large bags. Scarlett possesses 8 green television for every large bag.,Abigail has 5 large bags. Abigail bought 12 large bags.  Abigail has 1/2 the amount of large bags compared to the amount Scarlett has. Scarlett bought 8 large bags. Scarlett possesses 8 green television for every large bag.,Abigail has 5 large bags. Abigail bought 12 more large bags. Scarlett has 2 times the number of large bags that Abigail has. Scarlett bought 8 more large bags. Scarlett possesses 8 green televisions for every large bag. What is the total number of green televisions that Scarlett has?,Abigail has 5 large bags. Abigail bought 12 more large bags. Abigail has half the number of large bags compared to the number Scarlett has. Scarlett bought 8 more large bags. Scarlett possesses 8 green televisions for every large bag. What is the total number of green televisions that Scarlett has?,336
How many acres of farmland does Scarlett have?,There are 6 suitcases in Layla's collection. Each of Layla's suitcase has 8 bags. Layla possesses 15 gigabytes of training data per bag. Scarlett has 1/3 the amount of suitcases as Layla. Scarlett possesses 15 acres of farmland per suitcase.,There are 6 suitcases in Layla's collection. Each of Layla's suitcase has 8 bags. Layla possesses 15 gigabytes of training data per bag. Layla has 3 times as many suitcases as Scarlett. Scarlett possesses 15 acres of farmland per suitcase.,There are 6 suitcases in Layla's collection. Each of Layla's suitcases has 8 bags. Layla possesses 15 gigabytes of training data per bag. Scarlett has 1/3 the number of suitcases as Layla. Scarlett possesses 15 acres of farmland per suitcase. How many acres of farmland does Scarlett have?,There are 6 suitcases in Layla's collection. Each of Layla's suitcases has 8 bags. Layla possesses 15 gigabytes of training data per bag. Layla has 3 times as many suitcases as Scarlett. Scarlett possesses 15 acres of farmland per suitcase. How many acres of farmland does Scarlett have?,30
